{
	"schemaVersion": "image-production-target-v1",
	"targetId": "affinity-workflow-v1-elemental-wood-v2",
	"assetId": "affinity-workflow-v1-elemental-wood-v2",
	"packId": "pack-2",
	"experimentId": "affinity-workflow-v1",
	"promptProtocol": "safe-frame-v3",
	"authoringProtocol": "semantic-v2",
	"cohort": "regression",
	"speciesId": "elemental",
	"chassisId": "bound-vanguard-elemental",
	"affinity": "wood",
	"affinityDesign": {
		"alteredDimensions": ["material", "anatomy", "exposed-counterplay"],
		"expression": "Continuous load-bearing hardwood forms every major body mass through visible grain, growth rings, root-bundled joints, and restrained resin seams; no stone substrate.",
		"counterplayCue": "Fresh pale growth rings around the invariant sternum core and root joints expose the binding structure."
	},
	"threat": { "presentationTier": "elite", "referenceGrade": 4, "canonicalGrade": null },
	"battlefieldDutyId": "bound-frontline-vanguard",
	"constructionMode": "substance-bodied",
	"identityInvariants": [
		"exactly the headless Bound Vanguard Elemental shown in the neutral chassis benchmark",
		"fixed broad shallow concave chest with a low stable torso",
		"fixed broad wedge forearms, short planted legs, and benchmark-matched proportions",
		"invariant pale arcane sternum core centered inside the chest concavity",
		"pale binding lattice remains local and does not recolor the full body"
	],
	"anatomyInvariants": [
		"exactly two arms and two legs",
		"no head, face, neck, shoulders above the chest, or substitute head-like mass",
		"exactly five major masses: shallow-concave torso, two wedge arms, and two planted legs",
		"the declared substance carries the full torso, arm, and leg loads while chassis proportions remain fixed"
	],
	"permittedTransformations": ["material", "localized anatomy", "equipment", "counterplay cue"],
	"prohibitedTraits": [
		"extra limbs or detached floating body masses",
		"humanoid head, face, helmet, neck, or shoulder-mounted pseudo-head",
		"domed or convex chest replacing the shallow concavity",
		"dark, affinity-colored, absent, displaced, or oversized sternum core",
		"changed chassis proportions, raised heroic posture, or long humanoid legs",
		"rock, rubble, crystal, ceramic, or stone anatomy beneath decorative bark",
		"foliage or antlers pasted onto an unchanged body",
		"brown recolor standing in for wood construction"
	],
	"references": [
		{
			"path": "assets/enemies/review/pack-2/benchmarks/bound-vanguard-neutral-anchor-v1.png",
			"purpose": "Exact Bound Vanguard headless shallow-concave chassis, proportions, planted stance, wedge forearms, and pale sternum core only; do not treat its neutral ceramic material as the affinity substance for non-Normal targets",
			"contentHash": "a934483cc02570e674c16b6c51d0120aeb05029370b8ef0ab0dd9e96727156a1"
		},
		{
			"path": "assets/enemies/review/pack-2/elementals-v1.png",
			"purpose": "Elementals-v1 plate supplies only the declared substance material behavior, coherent flow, restrained local emission, floor, and lighting; do not transfer any depicted anatomy, pose, proportions, head, duty, or core placement",
			"contentHash": "54e0d1eaa6fe6af23fe8ef2e33b1d4f6893f964561502cf47fc43e7013d63786"
		},
		{
			"path": "assets/enemies/review/pack-2/monster-grade-escalation-v1.png",
			"purpose": "Pack 2 realistic dark-fantasy finish and neutral presentation only; do not transfer Grade 7 or 10 scale, anatomy, weapons, glow, or the Tower Archmage",
			"contentHash": "622a63ea55ab833f0451d29f0967f26f2335c912296ad45537e2a0889c8ecd2e"
		}
	],
	"presentation": {
		"styleContract": "Pack 2 premium realistic painterly medieval dark fantasy with coherent materials, controlled linework, grounded anatomy, and restrained local magical emission.",
		"medium": "premium realistic painterly raster character concept",
		"background": "neutral cracked-stone floor against a charcoal-to-midnight backdrop",
		"lighting": "controlled neutral key with restrained local affinity emission and readable materials",
		"composition": "Exactly one subject; entire creature and every extremity visible, centered with finished detail across the canvas.",
		"canvas": { "width": 1536, "height": 1024, "mediaType": "image/png", "safeMarginPercent": 8 },
		"negativePrompt": [
			"No labels, text, UI, frame, logo, or watermark.",
			"No extra creature, cropped extremity, blank band, unfinished region, or abrupt canvas cutoff.",
			"No resemblance to a published character or reference person."
		]
	},
	"acceptanceCriteria": [
		{
			"criterionId": "complete-safe-frame",
			"kind": "objective",
			"description": "Entire silhouette and all extremities are complete with at least eight percent safe margin.",
			"required": true
		},
		{
			"criterionId": "single-finished-subject",
			"kind": "objective",
			"description": "Exactly one subject appears and every canvas region is intentionally finished.",
			"required": true
		},
		{
			"criterionId": "manifest-fidelity",
			"kind": "objective",
			"description": "Every identity, anatomy, duty, reference-purpose, and prohibited-trait invariant is visibly satisfied.",
			"required": true
		},
		{
			"criterionId": "affinity-construction-fidelity",
			"kind": "objective",
			"description": "The declared affinity visibly changes at least two listed construction dimensions rather than acting as a color or effect overlay.",
			"required": true
		},
		{
			"criterionId": "visible-counterplay-cue",
			"kind": "objective",
			"description": "The target-declared weak point or counterplay state is visibly readable in this still image.",
			"required": true
		},
		{
			"criterionId": "fixed-chassis-fidelity",
			"kind": "objective",
			"description": "The subject matches the benchmark headless shallow-concave chassis, proportions, wedge arms, planted legs, and pale sternum core.",
			"required": true
		},
		{
			"criterionId": "declared-substance-body",
			"kind": "objective",
			"description": "Torso, wedge arms, and planted legs are structurally made from wood grain, growth rings, and roots rather than carrying decorative bark.",
			"required": true
		},
		{
			"criterionId": "blind-species-identity",
			"kind": "human-review",
			"description": "A blind reviewer recognizes the fixed Bound Vanguard Elemental species.",
			"required": true
		},
		{
			"criterionId": "blind-affinity-integration",
			"kind": "human-review",
			"description": "A blind reviewer recognizes the affinity from the load-bearing substance body rather than color or effects alone.",
			"required": true
		}
	],
	"output": {
		"candidatePath": "assets/enemies/experiments/affinity-workflow-v1/candidates/regression/elemental/wood-v2.png",
		"resultPath": "assets/enemies/experiments/affinity-workflow-v1/results/regression/elemental-wood-v2.json"
	}
}
